<?xml version="1.0" encoding="UTF-8"?>
<!DOCTYPE model SYSTEM "http://www.modeler.tslarusso.de/generator.dtd">
<model xmlns="http://www.modeler.tslarusso.de/modelerSchema"
       xmlns:xsi="http://www.w3.org/2001/XMLSchema-instance"
       xsi:schemaLocation="http://www.modeler.tslarusso.de/modeler.xsd">

	<iface type="de.example.interfaces.IDescriptor">
		<property name="name" type="String"/>
		<property name="uuid" type="int"/>
		<method returns="void" name="getStuff"/>
	</iface>

	<class type="de.example.model.DecorateeClass">
		<implements iface="de.example.interfaces.IDescriptor"/>
	</class>

	<class type="de.example.model.DecorateeClass2">
		<implements iface="de.example.interfaces.IDescriptor"/>
		<decorates name="decoratee1" type="de.example.model.DecorateeClass"/>
		<property name="type" type="String"/>
	</class>

	<class type="de.example.model.DecoratorClass">
		<decorates name="decoratee2" type="de.example.model.DecorateeClass2"/>
	</class>
</model>